{
  "l1_output_version": "1.0",
  "article_id": "0ce8988b24aadf1dfb5bbc7f2fc5fe38d185b079d8af2240921dfcb2a124bbf5",
  "title": "Campuchia mở rộng chiến lược tiếp thị nhằm thu hút khách quốc tế",
  "recognized": false,
  "entities": [],
  "categories": {
    "ticker_company": "none",
    "etf_fund": "none",
    "index": "none",
    "exchange": "none",
    "industry_sector": "none"
  },
  "unlisted_candidates": [],
  "citations": [],
  "confidence": 0.5,
  "processing_metadata": {
    "agent_provider": "gemini",
    "model_used": "gemini-3.7-flash",
    "timestamp": "2026-08-20T14:36:57.507663+07:00"
  }
}