{
  "l1_output_version": "1.0",
  "article_id": "ce207a52e774f94c39fb08e71fc1ee8029d897b00787485195a7ebd0a23afa86",
  "title": "Mỹ và Iran không gia hạn thỏa thuận ngừng bắn, giao thông ở Hormuz tê liệt",
  "recognized": true,
  "entities": [
    {
      "surface": "Mỹ",
      "entity_id": null,
      "type": "UNKNOWN",
      "method": "semantic",
      "in_list": false,
      "confidence": 0.8
    }
  ],
  "categories": {
    "ticker_company": "out_of_list",
    "etf_fund": "none",
    "index": "none",
    "exchange": "none",
    "industry_sector": "none"
  },
  "unlisted_candidates": [
    "Mỹ"
  ],
  "citations": [
    {
      "source_span": "Mỹ và Iran không gia hạn thỏa thuận ngừng bắn, giao thông ở Hormuz tê liệt"
    }
  ],
  "confidence": 0.95,
  "processing_metadata": {
    "agent_provider": "gemini",
    "model_used": "gemini-3.7-flash",
    "timestamp": "2026-08-20T14:36:57.507663+07:00"
  }
}