{
  "l1_output_version": "1.0",
  "article_id": "c7065c7de49b7706d7a1faf78d8d834e00db222e325fa4795abe2f2f3f6239eb",
  "title": "Ngân hàng Thương mại cổ phần Quân đội (HOSE)",
  "recognized": true,
  "entities": [
    {
      "surface": "Quân đội",
      "entity_id": "TICKER:MBB",
      "type": "TICKER",
      "method": "alias",
      "in_list": true,
      "confidence": 0.95
    },
    {
      "surface": "HOSE",
      "entity_id": "EXCHANGE:HOSE",
      "type": "EXCHANGE",
      "method": "alias",
      "in_list": true,
      "confidence": 0.95
    },
    {
      "surface": "Ngân hàng",
      "entity_id": "IND_GICS2:NGAN_HANG",
      "type": "INDUSTRY_GICS2",
      "method": "alias",
      "in_list": true,
      "confidence": 0.95
    }
  ],
  "categories": {
    "ticker_company": "done",
    "etf_fund": "none",
    "index": "none",
    "exchange": "done",
    "industry_sector": "done"
  },
  "unlisted_candidates": [],
  "citations": [
    {
      "source_span": "Ngân hàng Thương mại cổ phần Quân đội (HOSE)"
    }
  ],
  "confidence": 0.95,
  "processing_metadata": {
    "agent_provider": "gemini",
    "model_used": "gemini-3.7-flash",
    "timestamp": "2026-08-20T14:36:57.507663+07:00"
  }
}