{
  "l1_output_version": "1.0",
  "article_id": "f889c7c21701d6a062bcb30e52f87d2fb5be5b74520f585936772a2dc19740c3",
  "title": "'Ma trận' kinh doanh phía sau vợ chồng Phú Lê",
  "recognized": false,
  "entities": [],
  "categories": {
    "ticker_company": "none",
    "etf_fund": "none",
    "index": "none",
    "exchange": "none",
    "industry_sector": "none"
  },
  "unlisted_candidates": [],
  "citations": [],
  "confidence": 0.5,
  "processing_metadata": {
    "agent_provider": "gemini",
    "model_used": "gemini-3.7-flash",
    "timestamp": "2026-08-20T14:36:57.507663+07:00"
  }
}