{
  "l1_output_version": "1.0",
  "article_id": "b13b7bc979bc2d224e8b98f31ff4a576506a25e8b89eb59d7c04bdddb745c233",
  "title": "Bắc Ninh: Rà soát đưa ra khỏi quy hoạch các dự án không đảm bảo hạ tầng bảo vệ môi trường",
  "recognized": false,
  "entities": [],
  "categories": {
    "ticker_company": "none",
    "etf_fund": "none",
    "index": "none",
    "exchange": "none",
    "industry_sector": "none"
  },
  "unlisted_candidates": [],
  "citations": [],
  "confidence": 0.5,
  "processing_metadata": {
    "agent_provider": "gemini",
    "model_used": "gemini-3.7-flash",
    "timestamp": "2026-08-20T14:36:57.507663+07:00"
  }
}