{
  "l1_output_version": "1.0",
  "article_id": "e449a17c31666a1a70234eb0b4e37189a91739cc093b80bd8934f98a6bdfb6a8",
  "title": "UBS: Giá vàng có thể tiếp cận mốc 5.000 USD/oz trong nửa đầu năm 2027",
  "recognized": true,
  "entities": [
    {
      "surface": "UBS",
      "entity_id": null,
      "type": "UNKNOWN",
      "method": "semantic",
      "in_list": false,
      "confidence": 0.8
    }
  ],
  "categories": {
    "ticker_company": "out_of_list",
    "etf_fund": "none",
    "index": "none",
    "exchange": "none",
    "industry_sector": "none"
  },
  "unlisted_candidates": [
    "UBS"
  ],
  "citations": [
    {
      "source_span": "UBS: Giá vàng có thể tiếp cận mốc 5.000 USD/oz trong nửa đầu năm 2027"
    }
  ],
  "confidence": 0.95,
  "processing_metadata": {
    "agent_provider": "gemini",
    "model_used": "gemini-3.7-flash",
    "timestamp": "2026-08-20T14:36:57.507663+07:00"
  }
}