{
  "l1_output_version": "1.0",
  "article_id": "46107f6d2fbaebbd61c26da9c96b55064e363a0363c333afd8a64a58a226e3c4",
  "title": "Động thái mới nhất của Chủ tịch Thế Giới Di Động Nguyễn Đức Tài",
  "recognized": true,
  "entities": [
    {
      "surface": "Thế Giới Di Động",
      "entity_id": "TICKER:MWG",
      "type": "TICKER",
      "method": "alias",
      "in_list": true,
      "confidence": 0.95
    }
  ],
  "categories": {
    "ticker_company": "done",
    "etf_fund": "none",
    "index": "none",
    "exchange": "none",
    "industry_sector": "none"
  },
  "unlisted_candidates": [],
  "citations": [
    {
      "source_span": "Động thái mới nhất của Chủ tịch Thế Giới Di Động Nguyễn Đức Tài"
    }
  ],
  "confidence": 0.95,
  "processing_metadata": {
    "agent_provider": "gemini",
    "model_used": "gemini-3.7-flash",
    "timestamp": "2026-08-20T14:36:57.507663+07:00"
  }
}