{
  "l1_output_version": "1.0",
  "article_id": "abf67d06941617e673e6c26f721d5e9b6619fdea7bce2f17c4fbe2ed710f64aa",
  "title": "TP.Hồ Chí Minh sẽ đấu giá lô đất 6.446 m2 tại Thủ Thiêm",
  "recognized": false,
  "entities": [],
  "categories": {
    "ticker_company": "none",
    "etf_fund": "none",
    "index": "none",
    "exchange": "none",
    "industry_sector": "none"
  },
  "unlisted_candidates": [],
  "citations": [],
  "confidence": 0.5,
  "processing_metadata": {
    "agent_provider": "gemini",
    "model_used": "gemini-3.7-flash",
    "timestamp": "2026-08-20T14:36:57.507663+07:00"
  }
}