{
  "l1_output_version": "1.0",
  "article_id": "3f8646b9c7e47878449afa632071bb047f03d0ec4ea52a693cb27de66988c0d7",
  "title": "Blog chứng khoán: “Tiệc” tan",
  "recognized": false,
  "entities": [],
  "categories": {
    "ticker_company": "none",
    "etf_fund": "none",
    "index": "none",
    "exchange": "none",
    "industry_sector": "none"
  },
  "unlisted_candidates": [],
  "citations": [],
  "confidence": 0.5,
  "processing_metadata": {
    "agent_provider": "gemini",
    "model_used": "gemini-3.7-flash",
    "timestamp": "2026-08-20T14:36:57.507663+07:00"
  }
}