{
  "l1_output_version": "1.0",
  "article_id": "9e9e207b491b4aa09afd6047e4f304c31951e7b259d826148d5303d5f6de9774",
  "title": "Mỹ phải vay tiền với giá đắt nhất 25 năm",
  "recognized": true,
  "entities": [
    {
      "surface": "Mỹ",
      "entity_id": null,
      "type": "UNKNOWN",
      "method": "semantic",
      "in_list": false,
      "confidence": 0.8
    }
  ],
  "categories": {
    "ticker_company": "out_of_list",
    "etf_fund": "none",
    "index": "none",
    "exchange": "none",
    "industry_sector": "none"
  },
  "unlisted_candidates": [
    "Mỹ"
  ],
  "citations": [
    {
      "source_span": "Mỹ phải vay tiền với giá đắt nhất 25 năm"
    }
  ],
  "confidence": 0.95,
  "processing_metadata": {
    "agent_provider": "gemini",
    "model_used": "gemini-3.7-flash",
    "timestamp": "2026-08-20T14:36:57.507663+07:00"
  }
}