{
  "l1_output_version": "1.0",
  "article_id": "ea60f1f6530ee321060cc7864bff2bede515056cccf604673eaf205d4119a625",
  "title": "Nga cắt đường, phá cầu, chặn đứng tiếp tế ở Nam Ukraine",
  "recognized": true,
  "entities": [
    {
      "surface": "Nga",
      "entity_id": null,
      "type": "UNKNOWN",
      "method": "semantic",
      "in_list": false,
      "confidence": 0.8
    }
  ],
  "categories": {
    "ticker_company": "out_of_list",
    "etf_fund": "none",
    "index": "none",
    "exchange": "none",
    "industry_sector": "none"
  },
  "unlisted_candidates": [
    "Nga"
  ],
  "citations": [
    {
      "source_span": "Nga cắt đường, phá cầu, chặn đứng tiếp tế ở Nam Ukraine"
    }
  ],
  "confidence": 0.95,
  "processing_metadata": {
    "agent_provider": "gemini",
    "model_used": "gemini-3.7-flash",
    "timestamp": "2026-08-20T14:36:57.507663+07:00"
  }
}