{
  "l1_output_version": "1.0",
  "article_id": "78894fc67e2aad8f4904219c5bf15af16c7b083b1799112e636fc1901df11391",
  "title": "Đằng sau 1,2 triệu việc làm: Vingroup, FPT cùng PVN, Viettel ... đang gồng gánh bức tranh lao động ra sao?",
  "recognized": true,
  "entities": [
    {
      "surface": "FPT",
      "entity_id": "TICKER:FPT",
      "type": "TICKER",
      "method": "exact_code",
      "in_list": true,
      "confidence": 0.95
    },
    {
      "surface": "Vingroup",
      "entity_id": "TICKER:VIC",
      "type": "TICKER",
      "method": "alias",
      "in_list": true,
      "confidence": 0.95
    }
  ],
  "categories": {
    "ticker_company": "done",
    "etf_fund": "none",
    "index": "none",
    "exchange": "none",
    "industry_sector": "none"
  },
  "unlisted_candidates": [],
  "citations": [
    {
      "source_span": "Đằng sau 1,2 triệu việc làm: Vingroup, FPT cùng PVN, Viettel ... đang gồng gánh bức tranh lao động ra sao?"
    }
  ],
  "confidence": 0.95,
  "processing_metadata": {
    "agent_provider": "gemini",
    "model_used": "gemini-3.7-flash",
    "timestamp": "2026-08-20T14:36:57.507663+07:00"
  }
}