{
  "l1_output_version": "1.0",
  "article_id": "5d9b4e28cdafd4e785d6f460ec8b22bf3b9f0afe1cd300a389fc78284d4ac183",
  "title": "Tin vui: Hà Nội triển khai dự án có hơn 8.000 căn nhà ở giá rẻ",
  "recognized": false,
  "entities": [],
  "categories": {
    "ticker_company": "none",
    "etf_fund": "none",
    "index": "none",
    "exchange": "none",
    "industry_sector": "none"
  },
  "unlisted_candidates": [],
  "citations": [],
  "confidence": 0.5,
  "processing_metadata": {
    "agent_provider": "gemini",
    "model_used": "gemini-3.7-flash",
    "timestamp": "2026-08-20T14:36:57.507663+07:00"
  }
}