{
  "l1_output_version": "1.0",
  "article_id": "90387a8bac4e0695478158b819cd6797706829c233a943842c34e301e26d9bc4",
  "title": "CEO Janus Group: Câu chuyện tái cấu trúc nằm ở một vòng quay vốn có kỷ luật",
  "recognized": true,
  "entities": [
    {
      "surface": "Janus Group",
      "entity_id": "TICKER:TCO",
      "type": "TICKER",
      "method": "alias",
      "in_list": true,
      "confidence": 0.95
    }
  ],
  "categories": {
    "ticker_company": "done",
    "etf_fund": "none",
    "index": "none",
    "exchange": "none",
    "industry_sector": "none"
  },
  "unlisted_candidates": [],
  "citations": [
    {
      "source_span": "CEO Janus Group: Câu chuyện tái cấu trúc nằm ở một vòng quay vốn có kỷ luật"
    }
  ],
  "confidence": 0.95,
  "processing_metadata": {
    "agent_provider": "gemini",
    "model_used": "gemini-3.7-flash",
    "timestamp": "2026-08-20T14:36:57.507663+07:00"
  }
}