{
  "l1_output_version": "1.0",
  "article_id": "3e55f37defe40187215ad0044632e93654732c80b5054720c0021686ce7a6b24",
  "title": "Công ty Cổ phần Chứng khoán Thành phố Hồ Chí Minh (HOSE)",
  "recognized": true,
  "entities": [
    {
      "surface": "Chứng khoán Thành phố Hồ Chí Minh",
      "entity_id": "TICKER:HCM",
      "type": "TICKER",
      "method": "alias",
      "in_list": true,
      "confidence": 0.95
    },
    {
      "surface": "HOSE",
      "entity_id": "EXCHANGE:HOSE",
      "type": "EXCHANGE",
      "method": "alias",
      "in_list": true,
      "confidence": 0.95
    },
    {
      "surface": "Chứng khoán",
      "entity_id": "INDUSTRY_GICS2:Công ty chứng khoán",
      "type": "INDUSTRY_GICS2",
      "method": "semantic",
      "in_list": true,
      "confidence": 0.9
    }
  ],
  "categories": {
    "ticker_company": "done",
    "etf_fund": "none",
    "index": "none",
    "exchange": "done",
    "industry_sector": "done"
  },
  "unlisted_candidates": [],
  "citations": [
    {
      "source_span": "Công ty Cổ phần Chứng khoán Thành phố Hồ Chí Minh (HOSE)"
    }
  ],
  "confidence": 0.95,
  "processing_metadata": {
    "agent_provider": "gemini",
    "model_used": "gemini-3.7-flash",
    "timestamp": "2026-08-20T14:36:57.507663+07:00"
  }
}